{
  "$schema": "http://json-schema.org/draft-07/schema#",
  "additionalProperties": false,
  "items": {
    "properties": {
      "date": {
        "format": "date",
        "type": "string"
      },
      "link": {
        "format": "uri",
        "type": "string"
      },
      "sandboxId": {
        "minimum": 1,
        "type": "integer"
      },
      "tags": {
        "items": {
          "type": "string"
        },
        "type": "array"
      },
      "title": {
        "type": "string"
      }
    },
    "required": [
      "date",
      "link",
      "sandboxId",
      "tags",
      "title"
    ],
    "type": "object"
  },
  "type": "array"
}
